{
  "$schema": "../schemas/benchmark.schema.json",
  "id": "blender-5.2-rendering",
  "metric": "rendering",
  "source": {
    "name": "Blender Open Data",
    "url": "https://opendata.blender.org/",
    "licence": "CC0-1.0",
    "snapshot": "2026-10-31"
  },
  "method": "Blender 5.2.x; scenes monster, junkshop, classroom; median samples per minute per scene over at least 10 runs; geometric mean of the scenes. GPUs on their vendor's fastest backend (OptiX, HIP, oneAPI); CPUs on single-socket systems. User-submitted runs vary by several percent (AMD GPUs more, with HIP driver and settings), so treat gaps under 10% as a tie. VRAM variants of one chip share a score: amd-rx-9060-xt-16gb = amd-rx-9060-xt-8gb; nvidia-rtx-5060-ti-16gb = nvidia-rtx-5060-ti-8gb; nvidia-rtx-4060-ti-16gb = nvidia-rtx-4060-ti-8gb.",
  "baselines": {
    "gpu": "nvidia-rtx-4060",
    "cpu": "amd-ryzen-5-7600"
  },
  "scores": {
    "gpu": {
      "nvidia-rtx-5090": 535,
      "nvidia-rtx-4090": 383,
      "nvidia-rtx-5080": 307,
      "nvidia-rtx-4080": 276,
      "nvidia-rtx-4080-super": 273,
      "nvidia-rtx-5070-ti": 260,
      "nvidia-rtx-4070-ti-super": 234,
      "nvidia-rtx-4070-ti": 210,
      "nvidia-rtx-4070-super": 200,
      "nvidia-rtx-5070": 195,
      "nvidia-rtx-3090-ti": 177,
      "nvidia-rtx-4070": 172,
      "nvidia-rtx-3090": 172,
      "amd-rx-7900-xtx": 169,
      "nvidia-rtx-3080-ti": 165,
      "nvidia-rtx-5060-ti-16gb": 139,
      "nvidia-rtx-5060-ti-8gb": 139,
      "amd-rx-7900-xt": 139,
      "nvidia-rtx-4060-ti-16gb": 129,
      "nvidia-rtx-4060-ti-8gb": 129,
      "nvidia-rtx-5060": 124,
      "amd-rx-7900-gre": 115,
      "amd-rx-9070-xt": 113,
      "nvidia-rtx-3070-ti": 112,
      "nvidia-rtx-3070": 100,
      "nvidia-rtx-4060": 100,
      "amd-rx-9070": 100,
      "amd-rx-6900-xt": 97,
      "intel-arc-b580": 95,
      "nvidia-rtx-5050": 93,
      "amd-rx-7800-xt": 93,
      "nvidia-rtx-2080-ti": 92,
      "amd-rx-6800-xt": 89,
      "nvidia-rtx-3060-ti": 88,
      "nvidia-rtx-2070-super": 70,
      "amd-rx-6800": 70,
      "nvidia-rtx-2070": 65,
      "nvidia-rtx-2060-super": 65,
      "amd-rx-9060-xt-16gb": 56,
      "amd-rx-9060-xt-8gb": 56,
      "amd-rx-6700-xt": 55,
      "amd-rx-7600": 41,
      "amd-rx-5700-xt": 32,
      "nvidia-gtx-1660-ti": 23,
      "nvidia-gtx-1660-super": 23,
      "amd-rx-6600": 20,
      "nvidia-gtx-1650": 12
    },
    "cpu": {
      "amd-ryzen-9-9950x3d": 326,
      "amd-ryzen-9-9950x": 317,
      "intel-core-i9-14900kf": 282,
      "amd-ryzen-9-7950x3d": 275,
      "intel-core-ultra-9-285k": 272,
      "amd-ryzen-9-7950x": 272,
      "intel-core-i9-14900k": 250,
      "intel-core-i9-13900k": 247,
      "amd-ryzen-9-9900x": 243,
      "intel-core-ultra-7-265k": 230,
      "intel-core-ultra-7-265kf": 227,
      "intel-core-i7-14700k": 213,
      "amd-ryzen-9-7900x": 211,
      "amd-ryzen-9-7900": 200,
      "amd-ryzen-9-5950x": 197,
      "intel-core-i7-13700k": 184,
      "intel-core-i7-13700kf": 180,
      "amd-ryzen-7-9800x3d": 175,
      "intel-core-i9-12900k": 162,
      "intel-core-i5-14600kf": 158,
      "intel-core-i5-14600k": 153,
      "amd-ryzen-7-9700x": 152,
      "amd-ryzen-9-5900x": 151,
      "intel-core-i7-14700": 148,
      "amd-ryzen-7-7700x": 148,
      "intel-core-i5-13600kf": 146,
      "intel-core-i7-12700k": 145,
      "intel-core-i7-12700kf": 142,
      "amd-ryzen-7-7800x3d": 139,
      "amd-ryzen-7-7700": 136,
      "amd-ryzen-5-9600x": 130,
      "intel-core-ultra-5-245k": 129,
      "amd-ryzen-7-8700g": 126,
      "amd-ryzen-7-5800x3d": 108,
      "amd-ryzen-7-5700x": 108,
      "amd-ryzen-7-5800x": 107,
      "amd-ryzen-5-7500f": 103,
      "amd-ryzen-5-7600x": 102,
      "amd-ryzen-7-5700x3d": 100,
      "intel-core-i5-14400f": 100,
      "amd-ryzen-5-7600": 100,
      "amd-ryzen-7-5700g": 94,
      "intel-core-i5-12400f": 80,
      "amd-ryzen-5-5600x": 77,
      "amd-ryzen-5-5600g": 76,
      "amd-ryzen-5-5600": 73,
      "amd-ryzen-5-5500": 67,
      "amd-ryzen-5-3600": 65
    }
  },
  "runs": {
    "nvidia-rtx-5090": 207,
    "nvidia-rtx-4090": 108,
    "nvidia-rtx-5080": 378,
    "nvidia-rtx-4080": 69,
    "nvidia-rtx-4080-super": 41,
    "nvidia-rtx-5070-ti": 246,
    "nvidia-rtx-4070-ti-super": 45,
    "nvidia-rtx-4070-ti": 42,
    "nvidia-rtx-4070-super": 111,
    "nvidia-rtx-5070": 174,
    "nvidia-rtx-3090-ti": 16,
    "nvidia-rtx-4070": 39,
    "nvidia-rtx-3090": 102,
    "amd-rx-7900-xtx": 72,
    "nvidia-rtx-3080-ti": 63,
    "nvidia-rtx-5060-ti-16gb": 219,
    "nvidia-rtx-5060-ti-8gb": 219,
    "amd-rx-7900-xt": 33,
    "nvidia-rtx-4060-ti-16gb": 67,
    "nvidia-rtx-4060-ti-8gb": 67,
    "nvidia-rtx-5060": 103,
    "amd-rx-7900-gre": 32,
    "amd-rx-9070-xt": 409,
    "nvidia-rtx-3070-ti": 34,
    "nvidia-rtx-3070": 90,
    "nvidia-rtx-4060": 67,
    "amd-rx-9070": 28,
    "amd-rx-6900-xt": 10,
    "intel-arc-b580": 22,
    "nvidia-rtx-5050": 23,
    "amd-rx-7800-xt": 17,
    "nvidia-rtx-2080-ti": 17,
    "amd-rx-6800-xt": 18,
    "nvidia-rtx-3060-ti": 70,
    "nvidia-rtx-2070-super": 22,
    "amd-rx-6800": 22,
    "nvidia-rtx-2070": 14,
    "nvidia-rtx-2060-super": 20,
    "amd-rx-9060-xt-16gb": 62,
    "amd-rx-9060-xt-8gb": 62,
    "amd-rx-6700-xt": 20,
    "amd-rx-7600": 19,
    "amd-rx-5700-xt": 10,
    "nvidia-gtx-1660-ti": 29,
    "nvidia-gtx-1660-super": 26,
    "amd-rx-6600": 18,
    "nvidia-gtx-1650": 44,
    "amd-ryzen-9-9950x3d": 196,
    "amd-ryzen-9-9950x": 126,
    "intel-core-i9-14900kf": 34,
    "amd-ryzen-9-7950x3d": 47,
    "intel-core-ultra-9-285k": 109,
    "amd-ryzen-9-7950x": 29,
    "intel-core-i9-14900k": 90,
    "intel-core-i9-13900k": 20,
    "amd-ryzen-9-9900x": 62,
    "intel-core-ultra-7-265k": 27,
    "intel-core-ultra-7-265kf": 17,
    "intel-core-i7-14700k": 20,
    "amd-ryzen-9-7900x": 28,
    "amd-ryzen-9-7900": 11,
    "amd-ryzen-9-5950x": 114,
    "intel-core-i7-13700k": 18,
    "intel-core-i7-13700kf": 18,
    "amd-ryzen-7-9800x3d": 202,
    "intel-core-i9-12900k": 13,
    "intel-core-i5-14600kf": 19,
    "intel-core-i5-14600k": 31,
    "amd-ryzen-7-9700x": 82,
    "amd-ryzen-9-5900x": 46,
    "intel-core-i7-14700": 11,
    "amd-ryzen-7-7700x": 41,
    "intel-core-i5-13600kf": 10,
    "intel-core-i7-12700k": 17,
    "intel-core-i7-12700kf": 10,
    "amd-ryzen-7-7800x3d": 107,
    "amd-ryzen-7-7700": 24,
    "amd-ryzen-5-9600x": 72,
    "intel-core-ultra-5-245k": 28,
    "amd-ryzen-7-8700g": 11,
    "amd-ryzen-7-5800x3d": 101,
    "amd-ryzen-7-5700x": 109,
    "amd-ryzen-7-5800x": 39,
    "amd-ryzen-5-7500f": 56,
    "amd-ryzen-5-7600x": 20,
    "amd-ryzen-7-5700x3d": 17,
    "intel-core-i5-14400f": 11,
    "amd-ryzen-5-7600": 14,
    "amd-ryzen-7-5700g": 12,
    "intel-core-i5-12400f": 16,
    "amd-ryzen-5-5600x": 62,
    "amd-ryzen-5-5600g": 20,
    "amd-ryzen-5-5600": 59,
    "amd-ryzen-5-5500": 19,
    "amd-ryzen-5-3600": 42
  }
}
